{
  "target": {
    "plugin": "plugin-dev-planner",
    "skill": "assign-plugin-plan-evaluator",
    "skill_md_sha256": "c6ff6304a82eb742d30c015aa25847645905939c4403b410ddccf9f5482454ff"
  },
  "review_kind": "elegance",
  "verdict": "PASS",
  "reviewer": "run-elegant-review",
  "reviewed_at": "2026-06-30T08:12:36Z",
  "iterations": 1,
  "findings_summary": {
    "contradiction": 0,
    "omission": 0,
    "inconsistency": 1,
    "dependency_break": 0,
    "smell": 2
  },
  "human_review_required": false,
  "feedback_loop": {
    "loop_scope": "both",
    "criteria_evaluated": ["C1", "C2", "C3", "C4"],
    "positive_feedback": [
      "閾値とゲート集合の SSOT を機械強制している点が exemplary: _verdict/_load_thresholds が plan-rubric.json global_thresholds 一本から high_max/medium_max/all_gates_exit0 を読み、test_global_thresholds_loaded_from_rubric_ssot / test_verdict_enforces_global_thresholds / test_gate_defs_match_rubric_by_id_name_conditions が宣言↔実装 drift を fail-closed で封止する。前回 review で指摘された medium_max 未強制は本 SHA で解消済を実コードで確認 (横展開価値が高い)。",
      "proposer != approver を構造で保証: context:fork + Edit 非保有 + write=findings only + read-only-on-plan を SKILL/agent/prompt/schema の4層で一致させ、評価器が plan を書き換える Goodhart 経路が設計上塞がれている。",
      "8 決定論ゲート(core 5 scripts / 6 invocations + surface inventory + build handoff)が schema gate_results minItems:8・rubric deterministic_gates 8・EVALS.json mechanical[] と数で一致し、test_eval_harness_runs_every_gate_script / test_evaluator_projections_invoke_mechanical_runner が agent/SKILL の projection bash まで配線断線を機械検出している。",
      "C1-C4 ラベルの inner(本 skill の機械ゲート)/outer(run-elegant-review 30思考法)二層性を SKILL.md で明示 disambiguate し、同一ラベル多重定義による混乱を文書で先回り解消している。前回 review が指摘した omitted_surfaces 互換 alias は本 SHA で plugin 全体から完全除去され (grep 0 ヒット)、正本キー omitted_reason 一本に統一済を確認。"
    ],
    "negative_feedback": [
      "[inconsistency/low, 非ブロッキング] evaluate-plan.py の REQUIRED_PLUGIN_SURFACES (L42) が run-plugin-dev-plan/scripts/specfm.py の PLUGIN_LEVEL_SURFACES (L38) を逐語複製しているが、本 skill が閾値・ゲート集合には備える parity テストがこの surface タプルだけ存在しない。SSOT 二重定義を test で厳禁する自己規律の例外。drift しても G7(check-surface-inventory→specfm)が verdict 正当性を保つため影響は finding granularity 退化に限定され low だが、specfm を import 参照して一本化するか parity test で binding すべき。",
      "[smell/low] SKILL.md Key Rules #3 が bucket 例として 'rubric id (PLAN-001 等)' を挙げるが、plan-rubric.json の実 id は C1-C4 / G1-G8 / S1-S2 で 'PLAN-001' に対応する定義が rubric チェーン全体に無い (grep で SKILL.md 1 行のみ)。schema が任意非空文字列を許すため実害は無いが、存在しない id 形式を例示しており誤誘導の smell。'C1-C4 か G/S id' 等へ是正推奨。",
      "[smell/low] rubric.json は S2(plugin-level-surface-coverage)を semantic_checks に分類し four-condition-criteria.md/SKILL.md も『LLM が omitted_reason の意味妥当性を判定』と謳うが、evaluate-plan.py の _surface_findings は omitted_reason の存在/非空のみを決定論的に検査し G7(check-surface-inventory)と内容が重複する(意味判定ではない)。真の LLM semantic は S1(契約衝突)のみで S2 の semantic 分類は実装と齟齬。FAIL 時は同一 surface 欠落が G7 gate finding と _surface_findings で二重計上されるが両者 high ゆえ verdict 不変。"
    ],
    "iteration": 1,
    "iteration_limit": 3,
    "hook_trigger": "manual",
    "next_action": "none"
  },
  "notes": "C1 矛盾なし / C2 漏れなし / C4 依存関係整合 はクリーン。referenced 7 gate scripts + agent + schema 全実在を確認、skill 配下 10 tests を CI cwd (plugins/plugin-dev-planner) から実走し 10 passed。前回 verdict(SHA 74d130, medium_max 未強制 + omitted_surfaces alias)の 2 inconsistency は本 SHA(c6ff63)で両方解消済を実コード/grep で確認。残検出は全て low(SSOT 重複 1 inconsistency + 2 smell)で high 0 のため PASS。最重要 deferred=surface タプルの parity test 追加 (specfm SSOT 一本化)。"
}
