{
  "target": {
    "plugin": "harness-creator",
    "skill": "run-migrate-audit",
    "skill_md_sha256": "a1df34b0d4feeeecaff508a71672d4781b2c020a8cc0ea9c6b0155842f298604"
  },
  "review_kind": "rubric",
  "verdict": "PASS",
  "reviewer": "assign-skill-design-evaluator",
  "reviewed_at": "2026-06-25",
  "iterations": 1,
  "human_review_required": false,
  "feedback_loop": {
    "loop_scope": "both",
    "criteria_evaluated": [
      "IN1",
      "IN2",
      "OUT1",
      "OUT2"
    ],
    "positive_feedback": [
      "FM/BD 系: name=run-migrate-audit が FM-001(^run-... 正規表現・len<=60)に適合、description(line 3)が FM-002/003 の 〜とき 2個('移行したいとき'/'機械化したいとき')+句点終端を満たし、BD-001(## Purpose & Output Contract, line 55)/BD-002(## Gotchas, line 137)の必須 heading が存在、BD-003(本文 line 52-146 ≈95行 ≤300)を満たす",
      "frontmatter 完全性: kind=run / prefix=run / pair=assign-skill-design-evaluator / rubric_refs / reference_refs / responsibility_refs(prompts/R1-audit.md)/ schema_refs(schemas/output.schema.json)を備え ref-skill-design-rubric への照合経路が成立、IN1 の lint-skill-dep-step7 5条件と IN2 の抽象化・非破壊が verify_by=lint の決定論検査として機械検証可能性要件を満たす",
      "OUT1/OUT2 と loop_scope: OUT1(evaluator 採点ゲート)が pair 宣言と eval-<session>.json 出力で fork 採点を成立させ、OUT2(judge 可能な1行根拠)が Key Rules 4 と Checklist(line 106)で後段評価の入力品質を担保し、inner(IN1/IN2)/outer(OUT1/OUT2)双方が loop_scope 網羅要件に適合"
    ],
    "negative_feedback": [],
    "iteration": 1,
    "iteration_limit": 3,
    "hook_trigger": "manual",
    "next_action": "none"
  },
  "notes": "dev(main)同期merge後の現 SKILL.md(sha256 a1df34b0...)を全文 read し ref-skill-design-rubric/rubric.json v1.3.0 の kind=skill 適用 rule(FM-001..005/BD-001..004/NM-001..003/PD-001..002/KL-001..005)で genuine 採点。命名(NM-001/002): ディレクトリ basename と frontmatter.name=run-migrate-audit が一致、orchestrator role_suffix / hierarchy_level L1 も宣言済み。frontmatter(FM-004/005): description が動作詳細(採点する/sha256/exit code 等)を含まず発動条件のみ、名詞句始まり(1.1.0 日本語許容)で減点なし。allowed-tools(line 7)が Read/Write/Edit/Bash(python3 *)/Grep/Glob/Skill(assign-skill-design-evaluator *)に限定・DMI=false で過剰権限なし。本文(BD-001..004): ## Purpose & Output Contract と ## Gotchas が存在し BD-001 PASS により PD-002(冒頭30行集約)を包含充足、BD-004 は description の2 trigger('移行したいとき'→audit.py 棚卸し+8区分分類, '機械化したいとき'→lint+goal-seek 機械化)が body 手順へ 1:1 対応。PD-001: references/(classification-rules.md, abstraction-checklist.md, line 144-145)が存在し Progressive Disclosure 充足。KL-001..005: knowledge/ 無し・frontmatter.knowledge_loop 無し→存在ゲートで skip=PASS(誤減点なし)。source-traceability: source=doc/20-migration-path.md / source-tier=internal / last-audited / audit-trigger=source-update を記録。high severity 0件・閾値80超の重大欠陥なし=PASS。",
  "retargeted_from": {
    "eval_log_path": "eval-log/skill-creator/run-migrate-audit/content-review/",
    "retargeted_at": "2026-07-02"
  }
}
