{
  "target": {
    "plugin": "skill-creator",
    "skill": "run-goal-elicit",
    "skill_md_sha256": "2378547afaa66517e01b8aea6e2b5bb62ec80da5b7a50dc44ef0b7f4343c9370"
  },
  "review_kind": "elegance",
  "verdict": "PASS",
  "findings_summary": {
    "contradiction": 0,
    "omission": 0,
    "inconsistency": 0,
    "dependency_break": 0,
    "smell": 0
  },
  "reviewer": "run-elegant-review-subagent",
  "reviewed_at": "2026-06-24T07:25:30Z",
  "iterations": 1,
  "human_review_required": false,
  "feedback_loop": {
    "loop_scope": "both",
    "criteria_evaluated": ["IN1", "OUT1", "C1", "C2", "C3", "C4"],
    "positive_feedback": [
      "境界節 (line 42-44) が run-skill-elicit Step 4.4 / skill-brief.json との重複回避を checklist 型差 (構造化オブジェクト vs 文字列配列) まで明記し、両系統の混用を禁止。両スキルとスキーマ双方向で整合を実読確認した良設計。",
      "ゴールシーク正本 (goal-seek-paradigm.md) の6ステップを参照しつつ Step5 (中間成果物スナップショット/Anchor) を出力1点完結ゆえ適用除外する判断を completeness_exempt に根拠付きで明示。正本の Step 番号と一致し矛盾なし。"
    ],
    "negative_feedback": [],
    "iteration": 1,
    "iteration_limit": 3,
    "hook_trigger": "pre-push",
    "next_action": "none"
  },
  "notes": "C1(矛盾なし): checklist必須件数=本文line38『1項目以上』/schema minItems:1/検証scriptの assert len>=1 が三者一致。『ユーザー追加質問しない』ルールが主要ルール1・注意点・ゴールシークループStep1で一貫。contradiction edge=0。 C2(漏れなし): 目的と出力契約/境界/主要ルール/ゴールシーク実行(Goal/Why/Checklist/Loop)/検証/注意点/追加リソースが揃い、prompts・manifest 欠如は completeness_exempt に単一責務+ループ都度生成の根拠で正当化。MECE充足。 C3(整合性): rubric 1.3.0 に整合(本文79行<=300, trigger『とき』2個=2..3範囲内, descriptionに動作詳細語句なし, 日本語見出しは lint-skill-name/tree exit0 で受理確認)。Step5除外は正本と coherent。 C4(依存): reference_refs goal-seek-paradigm.md / schema_refs goal-spec.schema.json / 追加リソース run-goal-seek・skill-brief.schema.json 全て実在し解決。run-goal-seek が goal-spec を消費する handoff も双方向確認。dangling_ref=0 / cycle=0。検証scriptは有効サンプルで実走しPASS。高severity未解決なし。"
}
