{
  "target": {
    "plugin": "skill-creator",
    "skill": "delegate-codex-skill-review",
    "skill_md_sha256": "7e2728e2f2f8bdb09c02939d148896d0182305d81ac8118ce24d2d00b5a64e19"
  },
  "review_kind": "elegance",
  "verdict": "PASS",
  "findings_summary": {
    "contradiction": 0,
    "omission": 0,
    "inconsistency": 0,
    "dependency_break": 0,
    "smell": 0
  },
  "reviewer": "run-elegant-review-subagent",
  "reviewed_at": "2026-06-24T07:37:14Z",
  "iterations": 2,
  "human_review_required": false,
  "feedback_loop": {
    "loop_scope": "both",
    "criteria_evaluated": ["IN1", "OUT1", "C1", "C2", "C3", "C4"],
    "positive_feedback": [
      "PARA-001 表で内製(run-elegant-review)と外部委譲のトレードオフ(Sycophancy/再現性/依存/適用シーン)を明示し補完関係を成文化しており、opt-in cross-check の設計判断が読み手に追跡可能で良い設計。",
      "修復後コマンド例が正本 references/codex-connection.md L13-19 (codex --prompt/--context-file/--output-format text/--approval-mode yolo) と単一 SSOT に収束し、かつ『rubric は R2 プロンプト本文へ焼き込み別フラグでは渡さない』と設計意図を本文へ明記したことで、なぜ --rubric フラグが無いのかが読み手に追跡可能になり SSOT 一本化が genuine に達成された良設計。"
    ],
    "negative_feedback": [
      "[解消済 iteration1->2] C1 inconsistency(critical): SKILL.md L99-103 のコマンド例が 'codex review --input ... --rubric ...' と subcommand review を用い references/codex-connection.md L11(subcommand 非提供) および外部CLI正本 external-cli-agents-guide.md と矛盾していた。-> 正本の 'codex --prompt ... --context-file ... --output-format text --approval-mode yolo' へ書換え矛盾を除去 (inconsistency 0)。",
      "[解消済 iteration1->2] C1 inconsistency(critical): 出力先ファイル名が SKILL.md L101 のみ delegate-codex-review.json と第三の名前で、connection.md L18 / R2 prompt の delegate-codex-response.json から乖離していた。-> delegate-codex-response.json へ統一し grep で乖離名 0 件を実証。",
      "[解消済 iteration1->2] C4 dependency_break(high): SKILL.md L100 の --rubric ref-skill-design-rubric/rubric.json が dangling(実体 references/rubric.json)。-> ref-skill-design-rubric/references/rubric.json へ修正し dangling 0 を ls/grep で実証。同型 dangling だった R2-codex-review.md L72 も併せて references/ 付きへ修正。"
    ],
    "iteration": 2,
    "iteration_limit": 3,
    "hook_trigger": "pre-push",
    "next_action": "none"
  },
  "notes": "4条件(C1〜C4)で genuine 再検証(修復後 sha=7e2728e2f2f8)。C1(consistency)=PASS: codex 呼出形式が SKILL.md L100-104 と references/codex-connection.md L13-19 で一致(review subcommand 不在も整合)、出力名も全箇所 delegate-codex-response.json に統一(grep で delegate-codex-review.json 0 件)。C2(completeness)=PASS: Purpose & Output Contract / Key Rules / ゴールシーク / 局面カタログ / Gotchas / Additional Resources が MECE。C3(coherence)=PASS: コマンド形式・rubric パスが上位正本(external-cli-agents-guide.md / ref-skill-design-rubric 実体)と整合。C4(dependency)=PASS: 参照パス全件実在(rubric は ref-skill-design-rubric/references/rubric.json を ls 確認, dangling 0)。前回 iteration1 で記録した critical x2 + high x1 は本 iteration の実修復で全解消。高 severity 未解決なし -> PASS。"
}
