{
  "target": {
    "plugin": "skill-creator",
    "skill": "run-skill-rubric-governance",
    "skill_md_sha256": "decd41f1ed72fb43893d644ec390801946c9e1d0f03dd688c469a3690fa602b4"
  },
  "review_kind": "rubric",
  "verdict": "PASS",
  "findings_summary": {
    "contradiction": 0,
    "omission": 0,
    "inconsistency": 0,
    "dependency_break": 0,
    "smell": 0
  },
  "reviewer": "assign-skill-design-evaluator-subagent",
  "reviewed_at": "2026-06-24T07:27:19Z",
  "iterations": 1,
  "human_review_required": false,
  "feedback_loop": {
    "loop_scope": "both",
    "criteria_evaluated": ["FM-001", "FM-002", "FM-003", "FM-004", "FM-005", "BD-001", "BD-002", "BD-003", "BD-004", "NM-001", "NM-002", "NM-003", "PD-001", "PD-002"],
    "positive_feedback": [
      "frontmatter が token 節約契約(FM-004)を完全遵守: description『rubric変更を提案するとき、rubric改正を施行するときに使う。』は発動条件のみで動作詳細(sha256/exit code/採点する等)を一切含まず、〜とき trigger を 2 個(FM-003 のスイートスポット)・句点終端(FM-002)で簡潔に表現。本文は 94 行と max_skill_md_lines=300 に対し十分短く、長文ロジックを references/ と prompts/R1-govern.md(7層) へ Progressive Disclosure している点が rubric 思想(Less is More)に良く合致。"
    ],
    "negative_feedback": [],
    "iteration": 1,
    "iteration_limit": 3,
    "hook_trigger": "pre-push",
    "next_action": "none"
  },
  "notes": "rubric=ref-skill-design-rubric/references/rubric.json v1.3.0, kind=skill 適用 rule を採点。 FM-001(high)PASS: name 'run-skill-rubric-governance' は ^(run|ref|assign|wrap|delegate)- に一致・len<=60。 FM-002(med)PASS: description に 〜とき trigger かつ 。終端。 FM-003(med)PASS: trigger 数=2(提案するとき/施行するとき)で 2..3 範囲内。 FM-004(med)PASS: description に内部動作動詞(採点する/JSONで返す/sha256/exit code)なし。 FM-005(low)PASS: 日本語動詞句(提案する...に使う)で開始。 BD-001(high)PASS: '## Purpose & Output Contract'(line29)を厳格一致で保持。 BD-002(med)PASS: '## Gotchas'(line97)存在。 BD-003(high)PASS: frontmatter除外本文=94行<=300。 BD-004(med)PASS: description の2 trigger(提案/施行)が本文の提案->影響評価->猶予->発効フローへ 1:1 対応。 NM-001(high)PASS: dir basename 'run-skill-rubric-governance' == frontmatter.name。 NM-002(med)/NM-003(low)PASS: 命名・tree 規約準拠(prefix=run, kind=run 整合)。 PD-001(low)PASS: references/ に4ファイル存在(domain-rubric-template.json/governance-board.md/resource-map.yaml/version-rules.md)。 PD-002(med)PASS: 本文冒頭30行内に '## Purpose & Output Contract'(line29)+ 禁則 'rubric.json は本Runbook経由でのみ更新'『直接編集禁止』(line39) を集約(BD-001 ⊂ PD-002 包含関係を満たす)。 RG-001(low): 本skillは採点器でなく governance log(output.schema.json)を産出する Runbook のため rubric_hash 出力契約は非該当(違反ではない)。 KL-001..005: knowledge/ ディレクトリ・frontmatter.knowledge_loop ともに不在 -> 存在ゲートにより skip/PASS(誤減点なし)。高severity(FM-001/BD-001/BD-003/NM-001)全 PASS、未解決 high なし -> PASS。"
}
