{
  "target": {
    "plugin": "mf-kessai-invoice-check",
    "skill": "run-mf-invoice-check",
    "skill_md_sha256": "323e617711b7a8a50d6acfef9370245ec74df4db8cc0b4c594e368080b11e86c"
  },
  "review_kind": "elegance",
  "verdict": "PASS",
  "reviewer": "run-elegant-review-subagent-team",
  "reviewed_at": "2026-06-25",
  "iterations": 1,
  "human_review_required": false,
  "findings_summary": {
    "contradiction": 0,
    "omission": 0,
    "inconsistency": 0,
    "dependency_break": 0,
    "smell": 0
  },
  "feedback_loop": {
    "loop_scope": "both",
    "criteria_evaluated": ["IN1", "IN2", "OUT1"],
    "positive_feedback": [
      "二段確認を「指示」ではなく物理境界(collect=未検証JSON / finalize=確定JSON 別ファイル + sink の fail-closed exit2)で機構強制しており、Sycophancy/誤検出の混入を構造的に防いでいる。dev同期merge後も Key Rule 5『二段確認必須(標準フロー)』として導線維持(IN2)。",
      "merge で導入された『支払サイクル=年間払い かつ初回契約月から12ヶ月以内だけを機械が自動抑制/月払い・空欄・不明は fail-safe で候補に残す』(横断不変条件・Key Rule 6,7)が、契約終了等の人間判断列を機械が消さない既存不変条件と矛盾なく整合し、誤抑制を fail-safe 側へ倒している。",
      "月次履歴モデルの merge 移行(`__monthly_summary__` 集計行/DBプロパティ件数 → 各顧客ページ本文 table block・自然キー period_ym)が Purpose/Flow/R4/Checklist/Key Rule 4/Gotcha 5 へ一貫伝播し、片側更新ドリフトが残っていない。"
    ],
    "negative_feedback": [],
    "iteration": 1,
    "iteration_limit": 3,
    "hook_trigger": "manual",
    "next_action": "none"
  },
  "notes": "dev同期merge(git diff 67425a0..HEAD)後の現 SKILL.md を全文実読し、本スキル固有 criteria(IN1=差集合検知の issue_date 帰属と月またぎ正当性 / IN2=確定リスト不在 fail-closed の物理境界 / OUT1=collect→verify→finalize→sink + Notion 冪等 upsert の責務分割の過不足)で4条件を採点した。merge の主要変更=(a)入力に backfill(`--backfill --from/--to`)追加、(b)月次履歴を集計行から各顧客ページ本文 table block へ移行、(c)年間契約期間の自動抑制(`suppress_annual_period_gaps`)導入、(d)旧『ゴールシーク配線』(intermediate.jsonl アンカー)節の削除、(e)相対パス→`$CLAUDE_PLUGIN_ROOT` 化。本文記述を実装で検証: `lib/mfk_invoice_diff.py` に suppress_annual_period_gaps/billing_lifecycle が存在し period_ym ラベル==今月の不変条件を実装、`lib/notion_invoice_sink.py` が 1顧客=1ページ upsert と本文 table の period_ym 自然キー upsert(旧『判定』ヘッダ後方互換含む)を実装、`scripts/check_invoice_gaps.py` に backfill/--force-unverified が実装済で SKILL の記述と一致。【矛盾0】Purpose『issue_date 帰属の差集合』『顧客ID単独キー 1顧客=1ページ』が Flow・R4・Key Rule 3/4・Gotcha 4 と整合し相互背反なし。【漏れ0】OUT1 が要求する collect→verify→finalize→sink・Notion 冪等 upsert・参照専用二層・候補0件月の確認済み履歴(table 行)・年間契約 fail-safe がすべて本文に反映。【整合0】fail-closed exit2 / hook guard / GET 専用 lib の記述が SKILL/script/manifest/prompt 間で一貫。【依存破壊0】削除された旧 goal-seek 配線への参照が本文・Checklist・Resources に残存せず、Key Rule が 1-9 へ連番再採番されダングリング無し。Additional Resources の `$CLAUDE_PLUGIN_ROOT/...` パス先(ref-mf-kessai-api/lib/hooks/agents)も実在を確認。4条件すべて 0 で PASS。"
}
