{
  "target": {
    "plugin": "skill-intake",
    "skill": "run-intake-visualize",
    "skill_md_sha256": "423c8cfc091699d4279378f324e7b1c0aa9d8dfd0c6ddf73e32a7e5916a88ae2"
  },
  "review_kind": "elegance",
  "verdict": "PASS",
  "reviewer": "run-elegant-review-subagent-team",
  "reviewed_at": "2026-06-24T00:00:00Z",
  "iterations": 1,
  "human_review_required": false,
  "feedback_loop": {
    "loop_scope": "both",
    "criteria_evaluated": ["IN1", "IN2", "OUT1"],
    "positive_feedback": [
      "完了条件が『全 12 セクション 1〜3 図 + verify-visuals.py PASS + カタログ外 figure_id ゼロ + 同入力 2 回連続で visuals.json 完全一致』という機械検証可能形で Purpose・Checklist・ゴール間に一貫宣言され、IN1(schema+verify-visuals)と IN2(determinism)が inner ループで検証可能になっている",
      "Key Rule 1『カタログ外創作禁止(違反時 exit 2)』と Rule 4『倫理ガード=sheet.md にない事実を図に注入しない』、Gotcha 2『新規図種は本スキルで創作せず TODO 起票し差し戻し』が相互整合し、OUT1 の責務スコープ(決定論的配置のみ・創作/誤情報注入なし)が設計レベルで担保されている",
      "render_to_image.py の正本パス(aggregator 共有=plugins/skill-intake/scripts/)と mapping 表の薄 pointer 委譲(詳細スコアは guide 正本)が Gotcha で明示され SSOT 違反がない"
    ],
    "negative_feedback": [],
    "iteration": 1,
    "iteration_limit": 3,
    "hook_trigger": "manual",
    "next_action": "none"
  },
  "notes": "SKILL.md を全文精読し導出した criteria(IN1/IN2/OUT1)に照らして adequacy を確認した。Purpose & Output Contract・Key Rules・ゴールシーク(ゴール/Why/Checklist/ループ)・Gotchas・Additional Resources が相互に整合し、責務スコープ(カタログ既存図の決定論的配置と SVG→PNG 化のみ)・カタログ外創作禁止(exit 2)・倫理ガード(誤情報注入防止)・決定論性(2 回連続実行一致)が一貫して規定されている。出力契約(visuals.json schema 準拠 + verify-visuals.py exit 0 + 全 SVG の PNG 実在)は機械検証可能で IN1 を満たし、カタログ包含+determinism は IN2、創作/注入を行わない責務分離設計は OUT1 を満たす。今回は frontmatter への feedback_contract 携帯化に伴う再評価であり、本文(---以降)は不変で既存の elegance 健全性を維持しているため重大問題なしと判断。"
}
