{
  "target": {
    "plugin": "skill-creator",
    "skill": "wrap-git-commit-safe",
    "skill_md_sha256": "99cedfe7472a5ad67c1b18429fa5e96a842a4645c1484fe76ff82dd83d8a1dcf"
  },
  "review_kind": "elegance",
  "verdict": "PASS",
  "findings_summary": {
    "contradiction": 0,
    "omission": 0,
    "inconsistency": 0,
    "dependency_break": 0,
    "smell": 1
  },
  "reviewer": "run-elegant-review-subagent",
  "reviewed_at": "2026-06-24T07:28:56Z",
  "iterations": 1,
  "human_review_required": false,
  "feedback_loop": {
    "loop_scope": "both",
    "criteria_evaluated": ["IN1", "OUT1", "C1", "C2", "C3", "C4"],
    "positive_feedback": [
      "決定論検査をLLM文字列マッチから分離しscript(pre-commit-secret-scan.py, stdlib only)に寄せた二段防御が優秀。SKILL.md L72『検査不合格は即BLOCK(再試行で握り潰さない)』と整合し、wrap-*が『baseを上書きせず前後フックとして振る舞う』本質を機構レベルで体現している(『保証要件は機械層で担保』方針一致)。"
    ],
    "negative_feedback": [],
    "iteration": 1,
    "iteration_limit": 3,
    "hook_trigger": "pre-push",
    "next_action": "none"
  },
  "notes": "C1矛盾なし: Key Rules『--no-verify禁止』(L47)とscriptのcheck_bypass_flags(--no-verify/--no-gpg-sign)とチェックリスト(L66)が三者一貫し論理矛盾なし(contradiction_edges==0)。C2漏れなし: wrap-*必須要素(base/user-invocable/Purpose&Output Contract/Gotchas/ゴールシーク/schema_refs/script_refs)がMECEに充足(missing_elements==0)。C3整合性: rubric全rule PASS、effect:local-artifactコメントとbase実値・kind=wrapのbase必須要件がcanonical specと整合(violations==0)。C4依存関係整合: cycles==0 AND dangling_refs==0 を機械確認。SKILL.md本文・frontmatter(schema_refs/script_refs)が参照する全path(scripts/pre-commit-secret-scan.py, scripts/preflight-git-commit.py, templates/commit-template.md, schemas/wrap-io.schema.json, base run-build-skill, run-build-skill/references/goal-seek-paradigm.md, doc 06-classification-and-naming.md, doc 01a-build-flow.md)がls/Globで全て実在を確認。削除されたreferences/resource-map.yamlはSKILL.md・frontmatter・配下いずれからも参照されておらず(grep -rn resource-map → No matches)、references/ディレクトリ不在が正しい状態で dangling refs ゼロ。smell=1(low): templates/commit-template.md:27 の『TODO(human): 本リポジトリ固有のscope一覧を確定する。』は、設計書06およびtemplate L21が既にscope例(skill-creator/skill-intake/runtime/docs)を列挙済みでAIが文脈確定可能な実装ディテールを人間に委譲しており方針逸脱だが、rubric明示rule違反ではなく low severity。高severity(high/critical)未解決なし。PASS。"
}
