{
  "target": {
    "plugin": "skill-intake",
    "skill": "run-notion-fidelity-guard",
    "skill_md_sha256": "e342b50a1e83eb17970625340b0dfb30561ed407e9232f180dd1f49103685a73"
  },
  "review_kind": "elegance",
  "verdict": "PASS",
  "reviewer": "run-elegant-review-subagent-team",
  "reviewed_at": "2026-06-24T00:00:00Z",
  "iterations": 1,
  "human_review_required": false,
  "feedback_loop": {
    "loop_scope": "both",
    "criteria_evaluated": ["IN1", "IN2", "OUT1"],
    "positive_feedback": [
      "Key Rules / Gotchas / ゴールチェックリストが char_bounds 30% + required 40% + viz 30% と pass≥0.85/warn≥0.70/fail<0.70 の閾値・exit 0/1/2 写像で一貫し、IN1 の決定論判定を矛盾なく裏付けている",
      "責務単一性(構造粒度のみ)が Key Rules 1・Gotchas 5/6・関連スキルで一貫し、intake 妥当性=run-skill-intake / Notion 公開=run-notion-intake-publish への委譲先が一意で OUT1 の越境禁止設計を満たす"
    ],
    "negative_feedback": [],
    "iteration": 1,
    "iteration_limit": 3,
    "hook_trigger": "manual",
    "next_action": "none"
  },
  "notes": "SKILL.md 全文を実読し 4 条件で検証。矛盾なし=responsibility_refs(R1/R2/R3)と prompts 実在一致、char_bounds 計測=section_text_length() の単一定義。漏れなし=Purpose/Output Contract/Key Rules/Gotchas/ゴールチェックリストが pre/post-publish 双方と fail-fast≠silent-fail を網羅、約145行(<=300)。整合性=canonical SoT 所有者を run-skill-intake へ一意化、snapshot 手書き禁止を Key Rules 2 と Gotchas 1 で重複なく明記。依存関係整合=Notion API 認証情報を本スキル内で扱わず JSON 構造比較のみへ委譲先が解決可能。携帯化した feedback_contract(IN1/IN2/OUT1)が本文の評価観点と一致し adequacy 確認済み。"
}
