{
  "target": {"plugin":"contract-generator","skill":"run-contract-generate","skill_md_sha256":"6c4b8eb3549ef9c7f32c1ffeedec7d2468d8d33d758af3ef738b01c10516f754"},
  "review_kind": "elegance",
  "verdict": "PASS",
  "findings_summary": {"contradiction":0,"omission":0,"inconsistency":0,"dependency_break":0,"smell":0},
  "reviewer": "independent-content-review-subagent",
  "reviewed_at": "2026-07-03T22:13:52Z",
  "iterations": 1,
  "human_review_required": false,
  "feedback_loop": {
    "loop_scope": "both",
    "criteria_evaluated": ["IN1","IN2","OUT1"],
    "positive_feedback": ["draft 停止条件を『Docs黄色版+Slack通知+台帳draft化』へ限定し PDF確定/completed を run-contract-finalize、ひな形追従を run-template-sync へ責務分離する設計が Purpose(L45)/境界(L48)/ゴール(L63)/チェックリスト(L78-79)まで一貫し OUT1 を裏付け。今回の diff(L71 の行抽出条件を『ステータス≠completed』→『∈{空,未作成}(draft phase の _PHASE_STATUS_FILTER)+後方互換 legacy 1パスのみ ≠completed』へ精緻化)が Purpose L45『未作成』および phase 設計(L48/L63)と整合を高精度化。", "ひな形不改変(L51)+黄色 run(highlight YELLOW)のみ差込(IN2)+docx_fill.py 末尾の残存チェック(IN1)で法務承認済条文の非改変を validate.py/docx_fill.py の実コマンドへ紐づけ機械担保。"],
    "negative_feedback": [],
    "iteration": 1,
    "iteration_limit": 3,
    "hook_trigger": "manual",
    "next_action": "none"
  },
  "notes": "現 SHA (6c4b8eb3…) の SKILL.md を read-only 逐一照合した genuine 再評価。変更点=完了チェックリスト L71 の行抽出条件を『作成指示◯かつステータス≠completed』→『作成指示◯かつステータス∈{空,未作成}(既定 draft phase の _PHASE_STATUS_FILTER。後方互換 legacy 1パスのみ ≠completed)』へ分離明記。Purpose L45『作成指示◯ かつ 未作成』・phase 設計(L48/L63)と整合し曖昧さが解消され精度向上。C1(矛盾)/C2(漏れ)/C3(整合)/C4(依存)いずれも実害なし。IN1(未置換プレースホルダ残存なし)/IN2(黄色run限定差込で条文非改変)/OUT1(責務分離が負荷削減目的を最適反映)を裏付け PASS。"
}
