{
  "target": {
    "plugin": "slide-report-generator",
    "skill": "run-cross-deck-review",
    "skill_md_sha256": "8f09f0709db142a7643bb3bd90138d60ee9eae58e465daee5d6694631fc4d678"
  },
  "review_kind": "elegance",
  "verdict": "PASS",
  "findings_summary": {
    "contradiction": 0,
    "omission": 0,
    "inconsistency": 0,
    "dependency_break": 0,
    "smell": 2
  },
  "reviewer": "independent-subagent-elegance+fix-verify",
  "reviewed_at": "2026-07-05T10:36:37+00:00",
  "iterations": 2,
  "human_review_required": false,
  "feedback_loop": {
    "loop_scope": "both",
    "criteria_evaluated": [
      "IN1",
      "OUT1"
    ],
    "positive_feedback": [
      "[整合0/修正済] phantom mechanical check を実装実挙動へ honest 化: 初回 review が R1-orchestrate.md:71 と reference C2/C3 の `--check px-rule`/`--check slide-types` が cross-deck-consistency.js の checks map {shared-spec,urls,css-vars,gsap,print,rem-units} に非実装 (inconsistency) を検出。vendor script は digest-pin (byte-parity 対象) で改変不可のため、C2→`--check rem-units`(実在)・C3→Agent目視(slide-types は checkSharedSpec の key 不一致で無言スキップ=機械検出不能)・C1 の SVG設計/slide-types も Agent目視へ格下げし主張を実挙動に一致。grep で phantom --check ゼロを確認。",
      "[整合0/修正済] schema 二義の解消: 初回 review が R1:15/53『schema 未使用』と SKILL.md:34 schema_refs/manifest『出力契約』の矛盾 (inconsistency) を検出 → R1 を『schemas/cross-deck-review-report.schema.json = 横断整合レポートの構造契約 (conversation レンダ・機械 emit なし)』へ整合化。grep で『schema 未使用/なし』ゼロ。",
      "[整合0/修正済] R2-agent-cross-deck-reviewer.md:238-243 の想定入力例が『第N回/』命名で findSlideDecks の slide- prefix 収集 (JS:57) と不一致 → `slide-2026-01-*-第N回/` へ修正し機械走査と整合。",
      "[honest] R1:79/SKILL.md:107『機械チェック不能を隠さず WARN で明記』・SKILL.md:109/R1:167『一部検出で PASS 扱いにしない (OUT1 網羅性)』で anti-goodhart。R2:74 の --check 6カテゴリは JS の checks map と完全一致。"
    ],
    "negative_feedback": [
      "[smell/low, 非ブロッキング] cross-deck-consistency.js は upstream vendored (digest-pin) のため checkSharedSpec の key 不一致 (extractSharedSpecs 'svg-design-base' vs sectionNames 'svg-design'/'slide-types') は本 PR で修正せず、reference/prompt 側を実挙動 (Agent目視) に合わせて honest 化する方針を取った。",
      "[smell/low, 非ブロッキング] output は conversation-output のため schema は構造参照であり機械 emit/validate されない (設計選択)。"
    ],
    "iteration": 2,
    "iteration_limit": 3,
    "hook_trigger": "manual",
    "next_action": "none"
  },
  "notes": "初回独立 SubAgent が elegance で omission=1 (OUT1 テスト不在) + inconsistency=3 (phantom --check・schema 二義・入力例命名) を検出し FAIL。honest 化 4 修正 (phantom→実 check 名/Agent目視・schema 文言整合・入力例 slide- prefix) + OUT1 受入テスト新設で解消。fix→verify: lint-prompt-contract-drift fatal0・reference-attribution exit0・grep で phantom/schema矛盾ゼロ・vendor/tests/test-cross-deck-consistency.js が注入不整合(shared-spec/rem-units/urls)を全件検出+誤検出0 で node 実走 PASS。ハード4カテゴリ 0 で PASS。"
}