{
  "target": {
    "plugin": "harness-creator",
    "skill": "run-skill-create",
    "skill_md_sha256": "cbbf21da20132f8a17375d1bafc34393a7408706198dde75c405d1cf2c68e37b"
  },
  "review_kind": "elegance",
  "verdict": "PASS",
  "findings_summary": {
    "contradiction": 0,
    "omission": 0,
    "inconsistency": 0,
    "dependency_break": 0,
    "smell": 0
  },
  "reviewer": "independent-content-review-subagent",
  "reviewed_at": "2026-07-03T22:14:02Z",
  "iterations": 1,
  "human_review_required": false,
  "feedback_loop": {
    "loop_scope": "both",
    "criteria_evaluated": ["IN1", "IN2", "OUT1", "OUT2"],
    "positive_feedback": [
      "allowed-tools への `AskUserQuestion` 追加(line 16)が、本文の『全ゲートは AskUserQuestion 経由』(Key Rules 1, line 101)『ゲート前で必ず止まる』(禁則 line 86/Gotchas 1)というゲート停止要求を実行するのに必須な tool grant を補完し、宣言と granted tools の齟齬(依存の穴)を解消している(依存整合・矛盾なし)",
      "context:fork による evaluator/governance reviewer 独立起動が Key Rules 4(line 104)・Gotchas 2(line 167)・proposer≠approver・OUT1 criterion(line 52)で全節一致し、handoff schema 準拠保存(Key Rules 5/CL-12)も整合(整合性)",
      "feedback_contract の criteria が derived_from で Checklist の CL-* と機械的に紐付き(IN1←CL-7, IN2←CL-3/12, OUT1←CL-1/2/8/11, OUT2←CL-9/10)、End-to-End Flow(line 113-123)の Step/Gate 順序も workflow-manifest 正本へ委譲され漏れなく閉じている(漏れなし・依存整合)"
    ],
    "negative_feedback": [],
    "iteration": 1,
    "iteration_limit": 3,
    "hook_trigger": "manual",
    "next_action": "none"
  },
  "notes": "現 SHA (cbbf21da...) の SKILL.md を read-only 逐一照合した genuine 再評価。変更点=allowed-tools に `AskUserQuestion` を1行追加(line 16)。本文が全ゲートを AskUserQuestion 経由(Key Rules 1/起動フロー)で要求するのに tool grant が欠けていた齟齬を補完し依存整合を改善。①矛盾なし: AskUserQuestion 追加はゲート停止記述と整合。②漏れなし: 従来欠けていたゲート確認の実行権限を補完。③整合性: End-to-End Flow・Key Rules・Gotchas・ゴールシークループが既存記述のまま不変。④依存整合: 委譲先子skill・schemas・workflow-manifest との配線に影響なし。4条件全PASS。"
}
